title,description,full-description,aow,riasec,category,image,new
100 year counsellor,"100 year counsellors will help people to have a productive and fulfilling life, particularly as they age.","In the future our lives will be further extended by health and medical advances, so that we can expect our ‘Third Age’, after childhood and mid-lives which are focused on work and family, to be potentially ‘the best time of our lives’.
A 100 Year Counsellor will work with people over all of their lives, but particularly into the third age, so as to support them to have a productive and fulfilling life at any age.
They will work with individuals and groups, such as Local Community Growth Co-ordinators, to advise on how to effectively align psychological, social and economic aspects of each age, to maximise people’s human potential. They will also have a role as advocates for age transition management.
The 100 Year Counsellor will need to have human skills such as empathy and a caring disposition, but also good knowledge of health technologies such as anticipatory prosthetics, and the ability to communicate with professionals such as age-transition psychologists, nostalgists, and whole-of-life educators.","AOW5, AOW8","S, E",people,,new
Additive manufacturing engineer,Additive manufacturing engineers will be responsible for making everything from satellite dishes to refrigerators.,"Additive manufacturing engineers will be responsible for making everything from satellite dishes to refrigerators.
Additive manufacturing will have been around for 20 years. It involves the building up of a material product, layer by layer, using material in fine powder form. It is the opposite to traditional methods, where material is removed to carve a shape. It is closely allied to 3D printing, which is one method of additive manufacturing.
Additive manufacturing engineers will be increasingly in demand to design purpose built products, in particular prototypes, and high tolerance miniaturised machine parts.
The Additive Manufacturing Engineer will work with designers, technicians and material scientists.
Additive Manufacturing Engineers will have strong engineering skills, problem solving, and creative design skills. They also need strong communication skills and collaborative dispositions to work in multidisciplinary teams.",AOW19,"I, A",tech,,
Aesthetician,Aestheticians will help people enhance their physical appearances using the latest in biochemistry and fashion technology.,"Aestheticians work with people to enhance their physical appearances.
With technological advances and developments in biochemistry, aestheticians will design advanced beauty solutions involving the face, hair and body. They will offer personalised skin and haircare services designed specifically for the individual’s beauty and health needs, based on digital analysis.
Many Aestheticians will work closely with the aging population. They will design environmentally responsive makeup, hairstyles, eye lenses and fashionable face or body prosthetics for individualised looks, and consult about clothing choices that enhance a person’s overall appearance.
They may work with 3D Printed Fashion Designers and Virtual Avatar Generators as part of integrated image management services.
As surveillance in public places is now an everyday part of life, Aestheticians may help people to build physical appearances that maintain their privacy through the use of image-scrambling finishes and projections.
Aestheticians are highly creative, and have well-developed communication skills to work effectively with clients and collaborators. They will be able to use digital tools to analyse people’s beauty and health needs and apply digital solutions. They will be hands-on practitioners, and need to keep abreast of the latest developments in aesthetic digital and physical solutions.","AOW8, AOW15","S, A",people,,
Aged health carer of the future,Aged health carers will ensure the quality of life of elderly people.,"Aged Health Carers provide health support and caring services to elderly people.
In the future, with continuing advancements in medicine, elderly people who need ongoing care will be much older than those in residential facilities and nursing homes today.
Robots do much of the manual work (such as lifting and transport), provide support with daily living tasks, monitor patients, and manage records. Medication is managed by automated delivery systems.
Aged health carers are primarily responsible for ensuring the quality of life of elderly people, by spending time with them, interacting with them, and facilitating meaningful activities that they enjoy.
Aged Health Carers need high levels of emotional intelligence. They must be good listeners, having true empathy for older people and their families. They need to have some knowledge of medical and healthcare issues, and some digital literacies to interact with healthcare systems and robots. They will have knowledge of human psychology to help elderly patients feel valued and supported.","AOW5, AOW8",S,people,,
Aged persons climate solutions consultant,"Aged persons climate solutions consultants will work with government, councils, and elderly people to design strategies to guard against the effects of extreme weather on elderly populations.","As the planet warms we already have longer and hotter spells of weather, and more severe storms, that are dangerous for elderly citizens in particular.
Adverse effects from these weather events are concentrated in elderly populations.
An Aged Persons Climate Solutions Consultant will work with government, councils, and with elderly people directly to design strategies to guard against these effects of extreme weather.
Solutions will involve warning systems and automated monitoring, community retreats, and systems of health care workers advising and supporting individuals.
The Aged Persons Climate Solutions Consultant will be knowledgeable about the health implications of weather events, and skilled in devising creative strategies particular to the needs of different people and communities. They will have good communication skills working with government and with the elderly, and empathy and understanding of the needs of older people. They will have technology skills enabling them to conceive of and advise about monitoring and control systems.","AOW1, AOW5, AOW8, AOW10","S, I, A",env,,new
Agroecological farmer,"Agroecological farmers will grow crops and biofuel, while restoring agricultural balance.","The Agroecological Farmer grows crops and biofuel, while restoring agricultural balance.
They cultivate agricultural ecosystems, the different elements of which work together to create an effective, efficient and sustainable means of feeding and fuelling the planet.
Many Agroecological Farmers will be based in urban areas, where they run vertical farms, but others will still be located in rural areas.
The Agroecological Farmer cultivates trees, shrubs, and ‘weeds’ among crops, using intercropping techniques to create microclimates that are beneficial, and to repel pest insects. They will provide targeted irrigation to the root systems of plants, preventing run-off that might cause erosion and loss of soil nutrients.
Agroecological Farmers will use a wide range of technologies in their work, including robots for fieldwork, gene editing for hardy crops, and big data-informed practice. Sensors are embedded into the soil and air, measuring exactly how much of the right green fertiliser is needed, what the temperature is, and how much watering is required.
Agroecological farmers have knowledge of how plants, soil, insects, animals, nutrients, water and weather interact with one another to create the living systems. They know about how to grow food and biofuel in sustainable ways. They enjoy working with plants, and have practical skills in fieldwork and robot repair. They have good data analysis skills, and can use algorithmic software to learn what the best sustainable and productive framing options might be.","AOW1, AOW3, AOW10, AOW14, AOW16","R, C",ag,,
AI educator,"AI educators will help people make the most of artificial intelligence, including learning how to use digital tools and data, and how to work with digital and robotic assistants.","AI Educators will teach people about making the most of artificial intelligence.
This might include learning how to work with their household robots and digital assistants, through to learning how to use algorithmic tools to analyse big data or make decisions.
Unlike an algorithmic interpreter, who is there to explain exactly how artificial intelligence arrived at a particular answer, the AI educator will teach people how machines learn and adapt.
They will work with people to help them work out when and how to use their robot/assistant, ‘feed’ it the right data, and interact with it in ways that will get them the answers they want.
AI Educators will have excellent interpersonal skills, and have knowledge of teaching strategies that work with different kinds of clients. They will be digitally literate, and have good practical knowledge of robot/digital assistant interaction. A basic knowledge of machine learning will also be required.","AOW16, AOW17",S,people,,new
AI intellectual property negotiator,"AI intellectual property negotiators will negotiate for the ownership of new technologies, products, software, or other creative outputs.","AI Intellectual Property Negotiators will know the value of creativity.
They will negotiate on behalf of their clients for the ownership or use of new technologies, products, software, or other creative outputs.
In the innovation age, demand for intellectual property titles, such as patents, trademarks, industrial designs and copyright, will be enormous and very complex.
As well as negotiating on behalf of people who are developing artificial intelligence software and algorithms, the AI IP Negotiator will negotiate on behalf of artificially intelligent entities that have created new things. They will also represent people when artificial intelligence has used their ideas without permission.
AI Intellectual Property Negotiators will have advanced skills and knowledge in intellectual property law within their jurisdictions. They will have excellent analytical skills, along with interpersonal negotiation and persuasion capabilities. They will have strong attention to detail, and keep up to date with the latest in artificial intelligence developments.","AOW7, AOW12, AOW17","E, S",buslaw,,
Algorithm interpreter,Algorithm interpreters will help people understand how algorithms work and why artificial intelligence has come up with the decisions that it has.,"The basis of data analysis and decision- making is the algorithm that breaks data into patterns, which are then used for predictive intervention, such as predicting the personal preferences of individuals and what they are likely to purchase.
However, many people or companies working with algorithm-based decision-making software, or machines, will have a limited understanding of where these interpretations come from or the basis on which these decisions are made.
An Algorithm Interpreter will help people understand how algorithms work and why artificial intelligence has come up with decisions it has.
Interpretation topics might include algorithms for insurance evaluations, loan applications, employment decisions, court judgements, and dating app rejections. They will translate white box decision outcomes (when system workings are known) into plain English for people of all ages and cultural backgrounds. Some will help make sense of black box decision outcomes (when the internal workings of the system are not known). They may also interpret and report individual or company needs to software designers to maximise the effectiveness of the AI product.
The Algorithm Interpreter will need strong knowledge of coding processes and of statistical analysis. They will also need insight into human needs, and communication skills necessary for unpacking clients’ perspectives, and helping them with decisions based on the machine learning algorithmic output.","AOW17, AOW18","I, C, S",data,,new
Analogue experience guide,"Analogue experience guides will help people unplug from digital life and reconnect with the natural world, without digital implants or augmented reality.","Analogue Experience Guides support people to ‘unplug’ from digital life and reconnect with the natural world, without digital implants or augmented reality.
Analogue Experience Guides help people to appreciate a simpler and slower life by experiencing natural environments such as forests or mountainous areas without digital infrastructure or surveillance.
Along with psychologists and other healthcare workers, they may work with people to help them recover from digital, implant, or aesthetic modification addictions.
They may employ approaches such as: horticultural therapy (cultivation of plants); yoga; mindfulness techniques; traditional food preparation and cooking methods without bioprinting or other processing; and analogue art-making.
Analogue Experience Guides have strong interpersonal skills, and specific skills in their preferred therapeutic techniques. They have a deep appreciation of nature, horticultural skills, and prefer to live simply without too much digital input.","AOW2, AOW4, AOW8, AOW10","S, R",ex,,
Automated transit system troubleshooter,Automated transit system troubleshooters will address potential problems that occur in a transit system almost entirely comprised of autonomous self driving vehicles.,"These days, most of the vehicles on the roads drive themselves. The passengers in those cars get on with work, leisure activities, or even sleep while the car takes them where they need to go. These autonomous cars have many sensors on them, and they are networked together. They communicate with one another about their position, speed, the traffic conditions, hazards, and other environmental conditions. Traffic lights don’t exist anymore, as an automated transit management system ensures that everything runs smoothly and efficiently. The transit management system also makes sure that accidents don’t happen and everyone stays safe.
However, occasionally things go wrong that the automated systems can’t correct. Robots can easily deal with a single autonomous car breakdown — within two minutes they clear the car off the road and bring a replacement vehicle for the passengers. But they have more trouble dealing with the occasional human-driven old car, who may break the road rules and behave erratically. Sometimes hackers will break into a traffic management system and cause chaos. Very occasionally, an extreme weather event that wasn’t anticipated by the climate modifiers can bring everything to a standstill.
When things go wrong with the transit management system, the Automated Transit System Troubleshooter steps in.
They use monitoring systems and sensors to tell them what has gone wrong, and make rapid decisions about the best way to fix the problem. They may use digital algorithms to help them predict the consequences of different courses of action, and robotic or human workers to clear obstacles to traffic flow and get cars moving again.
They may also draw upon the expertise of an ethical hacker or cybersecurity personnel to repair the systems damage caused by malicious attacks.
Automated Transit System Troubleshooters will be decisive and quick thinking. They will be able to make sense of multiple sources of data in order to inform decisions. They will be effective risk managers, and competent using digital technologies. They will be clear communicators. They have strong disciplinary knowledge of traffic engineering and transport systems.","AOW11, AOW14, AOW16, AOW17, AOW18","C, I, E",urban,,new
Automation anomaly analyst,"Automation anomaly analysts will help others to understand, improve, and refine solutions generated by AI.","Sometimes, artificial intelligence will come up with a solution or recommendation that seems counter-intuitive, wrong, unethical, or just plain weird. In those circumstances, people will contact an Automation Anomaly Analyst for help and advice.
Automation Anomaly Analysts specialise in tweaking algorithms to make them better suit people’s needs, and ‘winding back’ the data inputs that have led to the strange result.
Automation Anomaly Analysts commence by understanding the client’s experience of the anomaly, and then act quickly to restore normal function.
In some instances, the anomalous result may turn out to be a new and useful solution, in which case the Automation Anomaly Analyst may not make any changes at all. In other instances, they may need to reboot systems entirely and start from scratch.
Automation Anomaly Analysts will be fast-thinking and fast-acting. They will have intimate knowledge of AI algorithms, and have up-to-the-minute knowledge of the latest trends in this area. They will be expert coders, and also good data processors.
Automation Anomaly Analysts will often be freelance or work in small to medium enterprises - these Automation Anomaly Analysts will need to be enterprising and entrepreneurial, with the aim of being the person that is top of mind to contact when a strange result happens.
Some big corporations and government agencies may have their own Automation Anomaly Analyst team.","AOW17, AOW18","C, I, E",tech,,new
Autonomous vehicle profile designer,Autonomous vehicle profile designers will custom design vehicles to suit the individual needs and tastes of the vehicle owner.,"In the future, driving will be optional as autonomous vehicles become more affordable and varied, leading to extended choice in forms of mobility.
As a result, the car as a transit experience will be redesigned. The basic car unit will be made up of a chassis with an electric drive-train and autonomous driving electronics.
An Autonomous Vehicle Profile Designer designs the cabin that will fit on top of the basic car unit. Each cabin will need to transform into multiple possible configurations, including bedroom, dining room, conference room, playroom, and gym (amongst others).
The Autonomous Vehicle Profile Designer will also ‘skin’ the inside and outside of cars — that is, uses augmented reality overlays to make the car’s look and feel reflect the personality and visual preferences of their owners. A car’s skin will become an extension of its owner’s personal avatar.
Autonomous Vehicle Profile Designer will have a background in interior and industrial design, and possess excellent creative and visual artistic skills. They will have knowledge of the properties of new materials that are being produced, such as transparent aluminium. They will be experienced in computer-aided design and the use of augmented reality engines.","AOW11, AOW16, AOW17, AOW19","A, I",urban,AutoVehicleDesigner.jpg,new
Behaviour prediction analyst,Behaviour prediction analysts will predict human and system behaviour based on data and algorithms.,"Our online presence is constantly increasing, signalling our tastes and preferences for clothing, music and entertainment, hobbies etc.
Similarly, patterns of behaviour of communities are able to be tracked through the increasing amount of data that is collected, stored and analysed. Algorithms are being invented to make sense of patterns in this data.
A Behaviour Prediction Analyst is a data scientist trained in the development of algorithms that can take big data sets to creatively project future patterns of behaviour across a variety of uses. These might include the personalised marketing of products, crime prediction, insurance company decisions, town planning, or government decision making.
A Behaviour Prediction Analyst will need skills in data mining and analysis, implying a logical problem-solving disposition. They will need critical and creative thinking skills, to identify unexpected patterns, but also strong human skills to be able to think through the way people behave so as to make sense of their patterns of activity and what these say about their individual and communal needs.","AOW2, AOW7, AOW17, AOW18","I, C",data,,new
Biofilm plumber,Biofilm plumbers will install and maintain coatings of biofilm onto the walls of sewerage and wastewater pipes and liquid composting bins.,"Biofilm Plumbers install and maintain coatings of biofilm onto the walls of sewerage and wastewater pipes and liquid composting bins.
These biofilms are made of millions of friendly bacteria that then break down complex organic matter (waste) of various types.
The bacteria are embedded into a sticky layer of extracellular polymeric substance, which binds to the wall of the pipe.
Just as it’s beneficial to have the right balance of bacteria in your gut, so, too, it’s important to have the right bacteria breaking down your waste.
Using digital bacterial analysis tools, Biofilm Plumbers diagnose problems with biofilm and rebalance bacteria if the waste breakdown isn’t working properly.
Biofilm Plumbers will be good at working with their hands. They will be good at problem-solving, and have an understanding of bacterial biology. They will be able to read and interpret schematics and plans. They may work as freelancers, or in teams of human habitat workers. As with plumbers in previous eras, they will sometimes need to work in dirty or smelly conditions.","AOW1, AOW10, AOW14","R, C",urban,,new
Bio-jacker,"Bio-jackers will be genetic engineers, undertaking precision genome editing of plants and animals, including humans.","Bio-jackers are genetic engineers who undertake precision genome editing of plants and animals, including humans.
Depending on their specialist area of expertise, plant Bio-jackers may manipulate the growth patterns and appearance of plants, along with the nutrition profiles of fruit and vegetables.
Human Bio-jackers alter the genetic make- up of people, in order to fix gene patterns that cause disorders and illnesses, and in some instances to change their appearance and/or physical abilities. This is a tightly regulated area, and the work of Bio-jackers must be thoroughly checked and certified for their potential impact to genetic diversity and the health of the host.
Bio-jackers undertake complex genetic analyses to identify potential genetic modifications that can fix potential problems or meet other needs, and then undertake genome editing using plasmids to transfect the target cells.
Bio-jackers will need in-depth knowledge of genetics, the processes of genetic engineering and genome editing, and what the results of these procedures are likely to be. Bio-jackers will work in teams and will need to be able to collaborate with others, such as genetic coaches and healthcare workers. They will also need training in advanced bioethics and genetic diversity practice.","AOW3, AOW9, AOW10, AOW17","I, C",ag,,new
Biometric security solutions engineer,"Biometric security solutions engineers will create individualised biometric signatures to use when accessing digital and physical access points, replacing online passwords and physical keys.","The days of losing your keys, forgetting your multiple passwords and having your identity stolen are in the past.
A Biometric Security Solutions Engineer creates individualised biometric signatures to use across all physical and digital secure access points, such as online banking and home, office or car access.
Biometrics measure physical and behavioural attributes such as fingerprints, iris and retina images, face and hand scans, voice recognition, and habitual patterns of behaviour.
Identity theft will no longer be possible as access systems will require multiple, randomly designated biometric measurements to confirm identification.
The Biometric Security Solutions Engineer determines which sensors are appropriate for the security solution, then applies software solutions to analyse and match the authentication factors. Biometrics security integrates with the overall security systems of a building or virtual system.
Biometric Security Solutions Engineers will be comfortable working with both software and hardware, and will understand the use of biometrics to develop unique identification solutions. They will be practical and enjoy gadgetry and electronics. They will also understand systems and be able to communicate well with colleagues in other security fields to ensure that biometrics take up their place in a suite of security measures.","AOW14, AOW18","R, C, I",urban,,
