title,description,full-description,aow,riasec,category,image,new
Mechatronics engineer,Mechatronic engineers will build and optimise robots.,"Mechatronics Engineers will build and optimise robots.
With skill sets that integrate knowledge from mechanics, electronics, control theory, and computer design, their aim is to optimise a robot’s ability to do the job it was built for.
There are many types of robots, but all have mechanical construction, electrical components, and computer programming code. In the future, nearly all robots have artificial intelligence coding, which means that they can learn and interact with their environment without being directly controlled by humans.
Many robots from the future will be bio- inspired, including robots that resemble humans, animals and plants in different ways. The reason for this is that there is recognition that nature’s engineering structures and processes often provide optimal ways of doing things.
Robots will be found everywhere — they provide security, assistance and support to people, and do physical tasks such as maintaining farming equipment or cleaning. Mechatronics Engineers will have excellent technical skills, including disciplinary backgrounds in mechanical engineering, electronics, and computing. They will be good problem-solvers, will have specific knowledge of industry standards, and will be comfortable working with computers. They will be logical thinkers who are good at maths, and often will have high levels of practical capability, and attention to detail.","AOW14, AOW15, AOW16, AOW17, AOW18, AOW19","I, C, R",tech,,
Media remixer,Media remixers will combine a variety of media from across time to create blended one-of-a-kind products or experiences.,"With individuals having access to a plethora of media, a Media Remixer will combine a variety of media from across time to create blended one-of-a-kind products or experiences.
The remix will combine video, audio, images and augmented reality to create artefacts such as marketing campaigns, educational tools, wedding montages, entertainment and bespoke experiences such as installation art or travel adventures.
A Media Remixer’s work will communicate their unique remix style and personal brand, and they will build a niche client base.
Media Remixers will work in a freelance capacity working on a portfolio of projects for a range of clients at the same time.
A Media Remixer will be both an artist and a producer with a passion for creativity and, skills and expertise in digital media. They will also need to be entrepreneurial and have business development and sales skills. Many will have a secondary skill set and domain expertise that enables them to specialise in particular artefacts or experiences. A Media Remixer will need to invest in developing their personal brand and a profile to communicate their unique remix style, build reputation and grow their target market.","AOW2, AOW4, AOW12, AOW15, AOW17","A, E",ex,,
Memory optimiser,"Memory optimisers will augment people's working memory capacities through digital implant technologies, and judicious memory erasure.","Information overload can be a challenge. Throughout the day, people are constantly ‘plugged in’ to augmented reality-based personalised information and news feeds, and are exposed to a wide array of digital visual and multisensory input.
Some people may need periods of time where they ‘unplug’, possibly with the support of an analogue experience guide. Others find that their day-to-day ability to process the data that they receive is insufficient.
The Memory Optimiser augments people’s working memory capacities through digital implant technologies, and can also free up existing capacity through judicious memory erasure.
The Memory Optimiser needs to be very careful about using these techniques, as there can be serious psychological and cognitive processing consequences both for people who are amnesic (that is, who have gaps in memory) and for those who are hyperthymesic (that is, who remember too much). They identify the right implant or memory erasure technique, and then design an integrated memory solution for the client. They do not operate on the patient themselves, but instead work as part of a team that includes bio-engineers, implant and erasure surgeons, and cognitive psychologists. Memory Optimisers will be specialists in cognitive psychology, with an emphasis on memory function. They will be familiar with digital memory enhancement and erasure techniques and technologies, and know how to use both to create an integrated memory solution. They problem-solve with excellent attention to detail, with educational backgrounds in biotechnology and brain architecture.","AOW8, AOW14",I,health,,
Multisensory experience designer,"Multisensory experience designers will bring together virtual reality, haptic and biofeedback/biometric technologies to create fully immersive basis of games and leisure activities, marketing campaigns, and education/training.","Multisensory Experience Designers bring together virtual reality, haptic and biofeedback/biometric technologies to create fully immersive basis of games and leisure activities, marketing campaigns, and education/training.
They work in teams with specialists in each of these fields to create experiences that are indistinguishable from the physical world, or alternatively that are incredibly different from the physical world, but are still ‘hyperreal’.
Multisensory Experience Designers know that while vision and hearing are the most dominant senses, a truly immersive experience also needs to have elements of touch and even smell to bring it to life. They make the most of implants that most people have in their central nervous systems to simulate certain elements of the experience, as well as implanted eye lenses, and ultrasonic waves for touch.
Multisensory Experience Designers will be very good at ‘visualising’ experiences across multiple senses. Using biofeedback mechanisms and tools, they will create personalised experiences for users. They will have backgrounds in user interface and user experience design, along with coding and human psychophysiology. Multisensory experience designers will need to be good team workers and have reasonable knowledge of haptic, virtual reality, and biometric technologies.","AOW2, AOW4, AOW15, AOW17","A, I",ex,,
Nanomedical engineer,Nanomedical engineers will design and plan personalised medical treatments that use nanoparticles.,"Nanomedical Engineers design and plan personalised medical treatments that use nanoparticles.
Nanoparticles are microscopic particles that can be tailored to detect and target viruses and cancer cells, and to create images of diseased parts of the human body to help diagnosis (similar to smart dust, only much smaller). Some nanoparticles called nanocages can also carry treatments for diseases, such as chemotherapy molecules. Others can target and destroy blood clots that have formed in the wrong places inside the body.
Nanomedical Engineers will have knowledge across engineering, medicine and science, specialising in biochemistry and nanoengineering. Given data about a patient’s health and a diagnosis, they will fabricate the right type of nanoparticle for the task, and functionalise it ready for use, by bioconjugating molecules to surfaces or particles. They will work in a team of nanoparticle engineers, nanoparticle diagnosticians, and nanoparticle pharmacy specialists, so will need strong teamwork skills as well as highly developed analytical skills.","AOW8, AOW14","I, C",health,NanoMedicalEng.jpg,
Net positive architect,Net positive architects will design building solutions to create viable and responsible commercial buildings or houses.,"With new materials, intelligent design and integrated sensor systems, buildings will be designed to produce more energy and water than they consume.
New rooftop photo-voltaic systems, and other onsite energy production and storage, intelligent building materials that insulate, produce energy and monitor the building environment, and advanced analytics software, allow buildings to be run such that they are suppliers to the national energy grid.
A Net Positive Architect will design building solutions, working with clients, software engineers and materials engineers, to create viable and responsible commercial buildings or houses.
The Net Positive Architect will have spatial design skills combined with knowledge of new materials, green building processes and software solutions. They will have communication skills as they work with other professionals and with clients to create solutions that are innovative and attend to specific needs.","AOW10, AOW11, AOW14, AOW15, AOW16, AOW17","A, I, C",urban,,new
New materials engineer ,New materials engineers will create innovative applications for cutting-edge materials and technology.,"Frontier materials, such as carbon nanotubes, aerogel, transparent aluminium or e-textiles, will transform the way we relate to everyday items.
New Materials Engineers will combine STEM discipline knowledge with creative ideas for applications that can improve lives.
These may include silk implants for damaged eardrums; strong, lightweight materials that save energy; or materials that can be recycled many times across their lives.
A New Materials Engineer will work in cross- disciplinary teams that combine science, engineering, computing, marketing, and social science. They could work for dedicated companies or be freelance, offering their skills to teams centred around product design.
A New Materials Engineer will have strong STEM disciplinary knowledge combined with computing skills and a creative, entrepreneurial outlook. They will need strong people skills to work in cross-disciplinary teams, and insight into human needs.",AOW19,"I, C, S",tech,,
Nostalgist,Nostalgists will recreate remembered experiences for the elderly.,"A Nostalgist works to recreate remembered experiences for the elderly.
Because people are so long lived, there will be a strong trade in recreating the best parts of life for people from 80 or 100 years ago.
Nostalgists can help people who suffer from dementia feel safer and happier, by building environments and experiences resembling the past and therefore familiar.
Nostalgists combine interior design expertise with personal digital research to design a personalised experience for their clients. People may wish to live in environments designed by Nostalgists, or to visit them virtually with the assistance of a virtual reality experience creator.
Nostalgists have excellent digital research skills, and will be good at listening to people to elicit details of the required memories. They have a strong command of interior and environmental design, and may collaborate with other professionals, such as, Virtual Reality Experience Creators and Aged Health Carers. A love of history and an eye for historical detail will be essential in this role.","AOW5, AOW6, AOW8, AOW15","S, A, I",people,Nostalgist.jpg,new
Nutri-gutome consultant ,Nutri-gutome consultants will support people's health by managing the bacteria in the human digestive tract.,"Nutri-gutome Consultants will be experts at optimising people’s health by working on, and through, the human digestive tract and the trillions of microorganisms (mostly bacteria) living within it.
The bacteria are involved in food digestion and absorbing nutrients from food, but they are also important to wider processes such as immune regulation and brain function.
Nutri-gutome Consultants will be known colloquially as ‘gut-bug keepers’, but their role will be very important — they will monitor the health of the bacteria and the digestive tract. If dysbiosis (an imbalance of bacteria) is found, they will design and implement interventions to ensure rebalancing. These solutions will include change of diet, pre- and probiotic administration, and microbiota cultivation and transplantation.
Nutri-gutome Consultants will work with body sensors and algorithmic analysis to identify dysbiosis and restore health.
Nutri-gutome consultants have a background in human biology and health science. They often have an interest in nutrition and dietetics, and all have knowledge and skills in microbiology and biotechnology. They have good attention to detail and analytical skills, as well as problem- solving capabilities.","AOW8, AOW9, AOW14, AOW15, AOW18","A, I, C",health,,
Offworld habitat designer,Offworld habitat designers will create habitable buildings and environments on other planets.,"As humans continue to explore space, plans to colonise other planets and moons will be developed.
Offworld Habitat Designers work with other specialists and scientists, such as the Terraforming Microbiologist, to build habitable buildings on other worlds. Beginning with scientific space stations but soon moving into tourism, Mars was the first planet to be offworld colonised, and several space stations are already in development with other planets and moons following after.
There is a need to design complete habitats for these offworld environments. This includes: points of interest, things to do (ranging from sport to adventure to exploring), accommodations and restaurants, along with all of the necessary support structures and infrastructures to manage and maintain.
The new habitats are designed to complement existing ecologies, so the Offworld Habitat Designers need to have high-level ecological awareness to ensure that comparable systems are put in place and local aspects are used within the new habitat design. Most existing habitat elements are hostile to human habitation. How do we ensure that the gravitational force in the area is suitable and stable? How do we protect people from radiation? How can we ensure an optimal mix of breathable air? These factors are at the forefront of the designers’ minds, something that Earth habitat designers don’t ever have to worry about. The Offworld Habitat Designer will have ecological and architectural skills and understandings and be creative in how they meet the challenges and possibilities in offworld locations. They will also have high level-communication skills as they will be designing alongside others.","AOW4, AOW11, AOW13, AOW14, AOW16, AOW19","A, I",space,,new
Personal brand manager & content curator,Personal brand managers and content creators will help people market themselves and their personal brand using digital technologies.,"A Personal Brand Manager and Content Creator will work with people to market themselves using digital tools.
The Brand Manager helps people to discover what their career aspirations are, and then constructs an avatar (virtual self) that aligns with this. They will design a brand and digital presence for the person, including curating artefacts such as images and 3D video of the person, building social networks and making posts to build that person’s social media influence.
Personal Brand Manager and Content Creators need to have written, oral and visual communication skills, to create a persona for someone else. They need to be able to listen to their clients to discover what their career plans are. They need to have skills and knowledge about social media platforms, as well as specialist knowledge about marketing, branding, and career opportunities. Advanced skills with digital media such as holographics, 3D video, and augmented reality will also be needed.","AOW2, AOW15","A, S",people,,
Personalised marketer,Personalised marketers will develop and implement marketing strategies that can market products with individualised content tailored to an individual person.,"Personalised Marketers develop and implement marketing strategies that use individualised content to market products, services and experiences to people and their automated decision support systems.
Through personal data collection based on body and behaviour sensors, and monitoring communities and the environment, Personalised Marketers find clever ways to engage people and influence their behaviour.
Personalised Marketers can work for marketing and advertising agencies, inside big companies, as freelancers, or for the government. They use algorithmic tools to figure out what people are interested in and motivated by, and match this up with advertising that will work for those people.
Personalised Marketers will be good at data analysis, and using automated tools to assist them with analysis. They will have educational backgrounds in marketing and advertising, and have knowledge of cross-platform marketing tools (such as augmented reality, personalised recommendation systems, and social media). They will create compelling stories, while having a deep understanding of what motivates consumer behaviour.","AOW2, AOW14, AOW17","E, S, A, I",buslaw,,
Predictive regulation analyst,"Predictive regulation analysts will forecast which aspects of upcoming changes to technology, business, society and the environment need government regulation.","Predictive Regulation Analysts forecast which aspects of upcoming changes to technology, business, society and the environment need government regulation, and to prompt government to put pre-emptive new laws and other measures in place if needed.
Predictive regulation analysts work inside government regulatory authorities that oversee commerce, enforce quality standards, safety, and use of resources. They use artificial intelligence algorithms to help them predict changes out in the world, although much of what they do is about interacting with businesses and technology companies in person to identify what the next big developments are going to be.
They make recommendations to government about changes that need to be made to existing regulations, or new laws that need to be drafted. For instance, in the early 21st century, the rapid introduction of Uber (peer-to-peer ridesharing) into the personal transport market meant that governments did not have enough of the right kinds of regulations to make sure that Uber drivers and passengers were safe and protected financially, and that the company was paying taxes on the income it was making. In the future, this kind of situation is very unlikely to occur, because Predictive Regulation Analysts can see when something is likely to change, and will ask the government to change regulations quickly.
Predictive Regulation Analysts will be experts in the laws and regulations operating in their jurisdictions. They will be familiar with the systems and processes of law, and able to use algorithmic tools to help them predict developments. They will be decisive, and have excellent oral communication skills to find out what is happening in an industry, and written communication skills to write briefs for governments recommending law changes. Most importantly, they will have strong knowledge of technological, social and business trends, and be able to use this knowledge to identify what will be happening next.","AOW6, AOW7, AOW12","C, E, S",data,,new
Quantum computer programmer,Quantum computer programmers will use high speed computers to solve complex and novel problems.,"Quantum computers use atomic quantum states in very low temperature devices, programmed using multiple laser beams, with interactions at the level of individual atoms.
Quantum computers make use of the rules of quantum mechanics to process information. In classical computers, processing is linear and sequential. But quantum computers rely on simultaneous superpositions of many inputs at once. Quantum computing speeds up processing exponentially over classical computers.
The different mode of logic functioning of quantum computers make them ideal for certain applications — artificial intelligence, cryptography, molecular modelling, medical diagnostics, weather prediction, financial modelling. They can seamlessly encrypt data to solve complex problems that even the most powerful supercomputers of the early 21st century could not.
Quantum computers operate with specialised programming languages, and Quantum Computer Programmers versed in these will apply their expertise to new and more complex problems. Their power and complexity will also represent challenges, and there will be a need for a strong core discipline of Quantum Computer Programmers who really understand how to creatively write error correction software for quantum computer applications.
Quantum Computer Programmers will need high level coding skills which imply clear problem analysis for the creation of complex algorithms. They will need human skills to interface with engineers and understand the particular structure of the problems that require solution. They will need patience and persistence.","AOW14, AOW17, AOW18","I, C",tech,,
Real-virtual transfer shop manager,Real-virtual transfer shop managers will use 3D printing and other technologies to create physical versions of virtual objects (and vice versa).,"As people spend more and more time in virtual and augmented reality, they want virtual versions of the objects, clothing, and furniture that they own in physical (‘real’) life.
They also want to be able to take home physical versions of things they have encountered in the augmented or virtual world.
The Real-Virtual Transfer Shop Manager will make this happen, by using 3D-printing and other advanced fabrication methods to create physical versions of virtual objects, and scanning/design tools to create virtual versions of physical ones.
The Real-Virtual Transfer shop will have self- service options for people who want a direct and simple transfer of an object.
The Real-Virtual Transfer Shop Manager will deal with very large and more complicated service requests.
The Real-Virtual Transfer Shop Manager will have good attention to detail, and excellent digital design skills. They will be able to use 3D printers and fabrication machines. They will have well developed interpersonal skills, to listen carefully to clients’ needs, and problem- solving capabilities.","AOW1, AOW2, AOW15, AOW19","R, S, C",buslaw,,new
Regional community growth co-ordinator,Regional community growth co-ordinators will support people looking to transition from urban to regional living.,"Although urban living in smart cities remains the popular choice, many are looking for something different. With connectivity now in place in all areas across the world including remote and rural areas, working online while living in rural settings is attractive to many. No more commuting while living and working in one place reduces infrastructure and ensures a significant cost saving to organisations.
However, the transition to regional living can be difficult for those long-term urbanites. This is where the Regional Community Growth Co-ordinator will provide assistance, working with local community co-ordinators and human habitat designers to make regional areas vibrant and interesting for people of all ages and interests.
Regional Community Growth Co-ordinators will market regional benefits and attractions to urbanites, encouraging them to re-locate. They will also market opportunities to regional organisations to ensure ongoing regional viability, distributed workforces, community collaborations, and networks. Focussing on artistic communities and food production will be key in these roles.
The Regional Community Growth Coordinator will have marketing skills and be a high-level communicator. They will be digitally literate as much of their communication is mediated via online conferencing. They will also be highly organised and efficient networkers as they coordinate people, ideas, opportunities and organisations.","AOW1, AOW2, AOW8, AOW11","E, S",urban,,new
Robot ethicist,"Robot ethicists will address ethical issues associated with artificial intelligence, robots, cyborg technologies, and augmented/virtual reality.","Ethicists are ethics experts.
A Robot Ethicist will be concerned with the ethical issues that are associated with artificial intelligence, robots, cyborg technologies, and augmented/virtual reality.
When a new technology or scenario involves emerging and contentious methods and applications where there are ethical or moral implications, an ethicist is frequently asked to provide input. They impart unbiased interpretations to help governments, businesses, professionals and families make informed decisions.
Key topics with which Robot Ethicists engage include robot rights (that people have moral obligations towards machines, particularly AI), weaponisation of AI, and robot morality. The Robot Ethicist’s analysis and input are aimed at preventing legal claims and making people feel confident and informed in their decisions.
Robot Ethicists will understand logic and how it interacts with human emotions, beliefs and moral standards. They will listen to and comprehend a variety of different opinions based on multiple logical and philosophical approaches, and fairly assess them. They will have excellent analytical skills, and a contemporary understanding of ethics as applied to digital technologies.","AOW6, AOW7, AOW12, AOW15, AOW16, AOW17",I,tech,,new
