title,description,full-description,aow,riasec,category,image,new
Biomimicry innovator,Biomimicry innovators will seek sustainable solutions to human challenges by emulating nature's engineering processes. ,"The Biomimicry Innovator seeks sustainable solutions to human challenges by emulating nature’s engineering processes. For instance, researchers are modelling energy-saving climate control systems on gas exchange mechanisms in termite mounds, or efficient and painless needles based on mosquito mouthparts.
The Biomimicry Innovator will be committed to sustainable innovation that is grounded in biological research, where they seek to understand the engineering complexities of plants, animal and microbe specialties. Transport strategies and materials properties are two further areas where diverse insect adaptations provide blueprints for innovations.
The role extends past research as they work to apply this knowledge to create products and processes that tackle global issues such as waste management, energy efficiency and agricultural solutions that mimic how ecosystems survive.
Biomimicry innovators will have advanced skills in biological science and will be driven by a curiosity of the natural world. They will have practical understandings from many engineering fields as they transform and problem solve. They will harness their research data to bring creative ideas to interdisciplinary teams. Good communication skills will enable them to communicate their research-inspired ideas with other collaborators as they work towards innovative solutions.",AOW12,"I, E, A",tech,,new
Bioprinting engineer,"Bioprinting engineers will create viable tissue for human implants, using hardware and software associated with next generation 3D printers.","3D printing will have an increasing range of applications in the future, including printing organic materials.
One possibility is synthetic meat, to respond to concerns about the climate and ethical ramifications of meat production.
Another is 3D printing of tissue such as cartilage, bone or muscle, or potentially internal organs, for tailored human implants.
Research on such implants is moving at a fast pace.
A Bioprinting Engineer will create viable tissue for human implants, using hardware and software associated with next generation 3D printers.
A Bioprinting Engineer will have strong engineering skills and STEM knowledge and will work in teams with biologists, medical specialists and software designers. They will have design skills and well-developed communication and interpersonal skills for effective teamwork.","AOW3, AOW8, AOW19","I, C, S",tech,,
Blockchain talent analyst,Blockchain talent analysts will work with employers to figure out what kind of person they want for a role and find the right person for the job using talent analytics algorithms.,"In the future, job recruitment will be managed by Blockchain Talent Analysts who work with blockchain — that is, verified and distributed measures of talent and hireability, including cognitive ability - to support recruitment. Data from online and networked behaviour, evidence of previous work and sensor-based data will provide a wealth of information about habits, preferences, skills and interests of potential employees. Blockchain can bring all these together to compile a comprehensive digital dossier about a person’s hiring potential.
Similarly, information asymmetries will be reduced and time-consuming tasks such as navigating the internet for jobs, filling in forms and transferring CVs to online templates will become a thing of the past. Instead, with your digital CV verified and cemented into blockchain, it will be available for those hiring, thus enabling employers to find the best employee match more easily. The personal brand manager and content creator will be involved in managing an individual’s data set.
The Blockchain Talent Analyst will work with employers to figure out what kind of person they want for a role (doing analysis of the employer’s capability and attributes profile using AI tools), and will then use talent analytics algorithms and ‘search bots’ to find the right person for a job. Interviews will no longer be required as the evidence to make accurate decisions will be collated through the Blockchain Talent Analyst.
The Blockchain Talent Analyst will have high level skills in analysing and interpreting algorithms, and interpersonal skills in communicating with clients and understanding the basis of their needs. They will have advanced understanding of ethical implications of data mining and personal privacy standards.","AOW6, AOW12, AOW18","I, S",buslaw,,
Chief digital augmentation officer,Chief digital augmentation officers will select the AI technology and other technological solutions (such as robotics and augmentations) for organisations.,"The Chief Digital Augmentation Officer, a high level strategic role in most corporations, is responsible for choosing the right AI technology and other technological solutions (such as robots) for tasks within the organisation.
They also design work processes where humans and machines can work together to complement each other. They provide employees with the right augmentation options and negotiate training and time to transition to them to full capacity.
In addition, as more humans seek implants and body/brain modifications that increase their capabilities as cyborgs, the Chief Digital Augmentation Officer will oversee the different management, working conditions and workplace rights that they will need.
The Chief Digital Augmentation Officer will have strong management and strategic skills and can inspire people. They will also understand anatomical and mechanical systems, ensuring that physical capabilities are enhanced responsibly and for maximum productivity.","AOW12, AOW16, AOW17","E, I",tech,,new
Chief ethics officer,Chief ethics officers will ensure that companies follow ethical and socially responsible policies and practices.,"Chief Ethics Officers work in large companies and government organisations.
Their role is to ensure that corporate social responsibility is considered in all of the company’s activities, and that the company is genuinely ethical in its practices.
The Chief Ethics Officer oversees the company’s adherence to zero waste policies, and its energy consumption and production targets. They make sure that the company is being socially inclusive, and its products and services are good for consumers.
It is widely recognised how expensive unethical behaviour can be (such as how much money is lost through not recycling or upcycling waste materials). Companies are committed to being as ethical as they can.
Chief Ethics Officer will also lead departments of staff and artificial intelligence units that are devoted to virtual ethics - such as making sure that unwanted social biases aren’t creeping into algorithms, and that people’s data is kept private.
Chief Ethics Officers keep up to date on the latest in robot and AI ethics. They have strong knowledge of the law, and professional/cultural codes of ethics related to their industry. They possess skills in critical thinking and problem-solving, and also management of information. Chief Ethics Officers lead teams, so they require people management and corporate leadership skills. They are good negotiators and mediators.",AOW12,"I, S",buslaw,EthicsOfficer.jpg,
Child assistant bot programmer,"Child assistant bot programmers will design humanoid robots to provide children with education, supervision, and play.","Living in a digital age has certain benefits.
One such benefit is that children’s games and toys can be programmed for specific purposes.
A Child Assistant Bot Programmer designs humanoid robots (kiddobots) that will support children to play safely. These bots can be personalised and programmed to align with family preferences, values and rules. They read nursery rhymes, personalise stories, teach basic numeracy and language skills, develop general knowledge, support the learning of spatial skills, and use coding games to develop digital literacies.
The bots are also used as tools to supervise and manage children’s free time, ensuring that they are physically safe and that they are safe in their online explorations too.
Children now only attend childhood education centres with their kiddobot (upgraded to match the centre’s overall system) to keep them safe, guide their interactions, and provide a platform for their education.
The Child Assistant Bot Programmer will have knowledge of AI programming and humanoid robot mechanics. They will also understand early childhood and child development as well as learning theories and practices. The programmers may work in teams with robot designers and program developers to ensure the flexibility in programs to include personalised family personalities and needs as well as to integrate with early childhood centres’ systems.","AOW16, AOW17","I, C",tech,,new
Community farm finance broker,Community farm finance brokers will connect farmers with individuals seeking to invest in their own food production.,"Many farms have moved to crowd funded production. As a key part of the wider ‘sharing economy’, this broker of financial support will link farmers with individuals/families prepared to invest in their own food production.
The farmer will continue to manage their farm and produce food, while the financiers will receive either produce or money for their investment.
Typically, the local agroecological vegetable farm, cricket farm or aquaponic fish farm will be mostly owned by local residents and community organisations. The net effect of this is that everyone will be involved and interested in their food production processes, and food security will be strengthened.
The Community Farm Finance Broker will be good with numbers but also good at marketing ethical opportunities and motivating people to make community minded choices. They will have a good understanding about agroecological farming practices and about the difficult choices that sometimes need to be made. They will be high-level communicators and convincing in promoting a point of view and in persuasive discussion.","AOW1, AOW3, AOW12","E, I, S",buslaw,,new
Community support worker,Community support workers will ensure the well-being of people engaging in communal living.,"Most people now live in small, close-knit communities within huge, sprawling metropolises.
Each community has at least one or two Community Support Workers, who work with the Local Community Co-ordinator to bring people together and ensure their well-being.
Community Support Workers work closely with people who need extra social support, such as the recently bereaved, people who are unwell, and people who have just moved into the community. The client gives them permission to monitor the sensors in their home and in their bodies, so that they can provide personalised support when it’s needed most.
Community Support Workers connect people with others in the community, and also connect them with targeted psychological support, healthcare, and social integration services.
Community Support Workers will be highly empathic people with strong social skills. They will be excellent listeners. They will have educational backgrounds in psychology and/or social work, and depending on their areas of specialisation, may also have postgraduate qualifications in working with older people, migrants, disabled people, or children. Community support workers will be well networked, and have in-depth knowledge of the support services available to their clients.","AOW1, AOW8",S,people,,
Cricket farmer,"Cricket farmers will monitor, maintain and breed crickets for healthy, high-protein food production.","People will turn towards more efficient protein sources.
Cricket farming will be an urban agriculture practice that produces large quantities of high-quality protein, micronutrients, calcium, zinc and heme iron (considered superior to plant-based iron).
Crickets consume plant products and produce very little waste making them an efficient energy source.
Vertical systems that require very little space where crickets thrive in optimal conditions will be designed. Robots and intelligent systems will monitor each cricket module, maintaining optimum growing conditions, monitoring inputs and growth rates.
Crickets will be turned into high protein flour for bread products and protein bars or deep fried to produce crispy snacks.
A Cricket farmer will use a variety of technologies and have a high level of digital literacy. They will use robots to monitor the crickets, and be able to maintain the machines and programs. They will manage the cricket selective breeding program where they design a range of cricket varieties to match different market needs. They will design and test cricket products to fill an increasing variety of product niches. Cricket farmers will be good collaborators and skilled communicators as they will be a key player in the food production industry.","AOW3, AOW16","R, C",ag,,
Cross-cultural capability facilitators,Cross-cultural capability facilitators will work with people in cross-cultural contexts to facilitate negotiations and projects.,"In the future, the importance and value of human diversity will be recognised, particularly the understanding that cultural groups have different and equally valid beliefs, needs, preferences, and ways of communicating.
Cross-cultural Capability Facilitators will be experts who have deep responsiveness towards, and respect for, people from diverse cultures and backgrounds. They will work directly with people in cross-cultural contexts to facilitate negotiations or projects. Many will also work with software programmers, robot designers and augmented/virtual reality experience creators so as to match the experiences they are creating with user needs and expectations, given their cultural backgrounds.
Cross-cultural Capability Facilitators will have strong knowledge of, and commitment to, principles of diversity and inclusion, international mobility, conflict resolution, and cultural sensitivity. They will likely to have spent significant time within a range of cultures learning their mores and dispositions. They may speak several languages, although real-time digital translation will reduce this requirement somewhat. They will be good listeners, be empathic and diplomatic. Depending on their work specialisation, they may also need to be competent programmers, robot builders, or augmented/virtual reality designers, or at least be comfortable working with people in these roles to build culturally sensitive digital experiences.",AOW1,S,people,,
Cyborg psychologist,"Cyborg psychologists will work with people who have synthetic organs, robotic limbs, and body implants, to help them come to terms with living as cyborgs.","A Cyborg Psychologist will work with people who have synthetic organs, robotic limbs, and body implants, to help them come to terms living as cyborgs.
They will also help clients who are suffering from digital addictions and compulsions, or those who have been having trouble distinguishing between the physical and the virtual world.
Technological advances mean that nearly all people will have some level of technological enhancement. Virtual and augmented reality will be part of everyday life for millions. But some people may struggle with various aspects of their digitally enabled life so Cyborg Psychologists will be there to help them.
Given the challenges that their clients will be facing, they may use AR and VR-based interventions, or they may prefer to use traditional techniques that involve talking directly with clients, and supporting them in challenging situations.
Cyborg Psychologists will need to relate to and empathise with a wide range of people. They will need to have excellent listening and oral communication skills, and the ability to cope with emotionally demanding situations. Cyborg psychologists will have in-depth knowledge of the impact of digital technologies on human psychological health and well-being, and of therapeutic techniques to address these.","AOW8, AOW14, AOW15, AOW16","S, I",people,CyborgPsychologist.jpg,
Data commodities broker,"Data commodities brokers will sell collected data on behalf of people, communities and corporations, feeding the data into machine learning algorithms.","Data is very valuable. In the future it is used to inform every sphere of human activity, including marketing, development of products and services, healthcare, and government services.
Data commodities brokers sell collected data on behalf of people, communities and corporations, that will then be fed into machine learning algorithms for different purposes. I
In historical times, people gave away their data for free. The data that was captured through their online behaviour (e.g., web sites that they visited, interactions with other people) was taken and used for sales and marketing of products back to those people.
These days, data is sold to different agencies. People can decide which types of agency their data will be sold to, what it will be used for, and for how much money they are prepared to sell it. For instance, a community area contains environmental sensors that pick up information about its residents, the environment, energy use, and patterns of consumption. The community employs a data commodities broker to negotiate the sale of this data. Data Commodities Brokers will have a background in sales or commerce, with specific interests in financial and data management. They will have strong maths, logic and problem-solving skills, and have data-based research capabilities to understand the market demand for a particular type of data. They will work with algorithmic software to undertake projections. They will have solid negotiating skills, and an understanding of data law.","AOW2, AOW18","E, I, C",data,,new
Data farmer,Data farmers will create and manage semi-autonomous algorithms that will identify and trace connections between otherwise unrelated sets of data.,"Reminiscent of the gold farmers of early online games and the bitcoin miners of the early 21st century, these bulk data analysts called Data Farmers create and wrangle semi-autonomous algorithms that identify and trace connections between otherwise unrelated sets of data.
Part accountant, part detective, part service worker, Data Farmers ‘milk’ their algorithms regularly to extract meaningful extrapolations from stochastic data comparisons. They then pass what they’ve learned on to businesses, community co-ordinators, and government agencies to predict trends that can be used for new products and services, regulation of commerce, and community/environmental strategies.
Data Farmers will have good programming and algorithmic design skills. They will be creative and have cognitive flexibility to combine or group data in different ways, and to identify the connections between them. They will be good problem-solvers and have excellent analytical skills. Many Data Farmers working in industry will need to be quite entrepreneurial, as they will often be freelance, or employed by small to medium enterprises. They will need to pitch to businesses and sell the meaningful connections and predictions that they’ve identified.","AOW12, AOW17, AOW18","I, C, E",data,,new
Data privacy strategist,Data privacy strategists will be responsible for designing solutions to protect people's data.,"A Data Privacy Strategist will be responsible for designing solutions to protect people’s data.
In the future, data privacy will be harder than ever to safeguard, because everyone will be always ‘plugged in’ to networks through the digital implants in their bodies that ensure their health and enhance their lifestyles.
Hacking will be a major problem, personal data can be taken hostage for ransom, and identity theft can have serious repercussions.
Data Privacy Strategists set up systems and software to reduce the risk of hacking. If a system is hacked, they may work to repair it, recover data, and minimise the impact on people’s lives.
Data Privacy Strategists have strong analytical skills, and will be detail-oriented. They have high levels of digital literacy, and knowledge of the latest trends in cybersecurity. They have coding skills, and understand systems architecture, firewalls, networking and operating systems.",AOW18,"I, C",data,,
Data storage solutions designer,Data storage solutions designers will draw on a variety of innovative and fast changing data storage systems to create purpose built solutions for clients. ,"As digital systems become more complex and pervasive, huge demands are made on data storage.
Such technologies as Augmented (AR) and Virtual Reality (VR), Artificial Intelligence (AI), and sensor technologies, have huge data storage demands, not only in terms of capacity but in robustness and durability.
Data Storage Solutions Designers will draw on a variety of innovative and fast changing data storage systems to create purpose built solutions for clients. For instance, one solution involves DNA storage. DNA is smaller than even a microchip, and can reach a density of 215 Petabytes of storage per gram. Just four grams of DNA can contain a year’s worth of information produced by all of humanity combined. DNA is durable, and lasts for over 100 years. Other possible solutions include nanoparticles, in ‘soft matter’ to make a liquid storage device, or holographic versatile discs.
The Data Storage Solutions Designer will have high level digital engineering skills, able to select and creatively suggest the modification and application of existing technologies to specific storage problems. They will need to understand the nature and requirements of a variety of data forms and storage requirements. They will often work in transdisciplinary teams to develop viable solutions, implying strong collaborative and communication skills.",AOW18,"I, C",data,,
Data waste recycler,"Data waste recyclers will receive data recommended for deletion from companies, communities and individuals, and review it to see if it can be recycled for other purposes.","As part of routine data management processes, or an intervention led by a virtual clutter organiser, data may be recommended for deletion. In a world where data is extremely valuable and is used to inform everything from the marketing of products and services to healthcare and determining how much food to produce, erasure is a serious matter.
Data Waste Recyclers receive data that are recommended for deletion from companies, communities and individuals. They assess the data for usefulness. Depending on what they find, they may recommend selling the data using a data broker, archiving it, discarding it, or returning it to service, with or without cleaning and further refinement.
Data Waste Recyclers are an important part of the data health of the world in which we now live.
Data Waste Recyclers will have exceptional attention to detail. They will be good at analysing and interrogating data sets for usefulness and dangerous features (such as bugs, corruption or anomalies). They will know what data can be used for, and what types of data are most in demand by different types of users. They will be familiar with the latest in data management and archiving techniques.","AOW10, AOW17, AOW18",C,data,,new
Data-based medical diagnostician,Data-based medical diagnosticians will specialise in making sense of data in order to make medical diagnoses in complex cases or where the patient has mysterious symptoms.,"The Data-based Medical Diagnostician will specialise in making sense of data in order to make medical diagnoses in complex cases or where the patient has mysterious symptoms.
The diagnostician will draw together large amounts of data from many different sources, including the patient’s health tracking implants, environmental monitoring devices, tests that have been run by doctors, genetic profiles, and the life history data for the patient.
They will also have access to billions of documents and diagnostic databases containing information about diseases.
They will be assisted by AI algorithms, which can scan and analyse data quickly, and identify anomalies, but the diagnostician will be responsible for piecing together the relevant information and identifying what is wrong with the patient and how to treat it.
Once a diagnosis is made, the diagnostician will relay it to other members of the medical team, with recommendations about the right therapeutic approaches to take.
The Data-based Medical Diagnostician will be highly creative and also have advanced data analysis skills They will have significant medical knowledge and excellent pattern recognition capabilities. They will be able to think and act quickly, and will use AI tools to find solutions. They may not need patient caregiving or treatment skills, as this can be undertaken by others once the diagnosis is made.","AOW8, AOW14, AOW17",I,health,,
